{
 "format": "rules/1",
 "version": "2.1.0",
 "count": 197,
 "rules": [
  {
   "id": "B-01",
   "level": "required",
   "applies_to": [
    "building"
   ],
   "guide": "1 Builder's and Architect's",
   "statement": "Deliver an IFC schema edition the profile accepts (`schema.allowed`, default IFC4).",
   "rationale": "Readers support different schema editions; a file in an unlisted edition may not open or may lose data.",
   "how_to_check": {
    "tool": "tools/check_ifc.py",
    "command": "python3 tools/check_ifc.py MASTER.ifc --profile PROFILE.json --finish-schedule finishes/finish-schedule.json --json",
    "method": "automated: the finding carries rule id B-01"
   },
   "automated": true,
   "fix_hint": "Export the file in an IFC schema edition the profile accepts (schema.allowed).",
   "examples": {
    "good": "FILE_SCHEMA(('IFC4'));",
    "bad": "FILE_SCHEMA(('IFC2X3'));"
   },
   "related": [],
   "parameters": [
    "schema.allowed"
   ],
   "extension": null
  },
  {
   "id": "B-02",
   "level": "required",
   "applies_to": [
    "building"
   ],
   "guide": "1 Builder's and Architect's",
   "statement": "Declare the length unit as metres (an `IfcSIUnit` `LENGTHUNIT` `METRE`, or a prefixed or conversion-based unit that resolves to metres) and model in it.",
   "rationale": "Without a declared unit a reader must guess; a wrong guess rescales the whole building.",
   "how_to_check": {
    "tool": "tools/check_ifc.py",
    "command": "python3 tools/check_ifc.py MASTER.ifc --profile PROFILE.json --finish-schedule finishes/finish-schedule.json --json",
    "method": "automated: the finding carries rule id B-02"
   },
   "automated": true,
   "fix_hint": "Declare an IfcSIUnit LENGTHUNIT METRE in the project's unit assignment and model in metres.",
   "examples": {
    "good": "IFCSIUNIT(*,.LENGTHUNIT.,$,.METRE.)",
    "bad": "no length unit, or .MILLI. METRE with metre-sized numbers"
   },
   "related": [
    "B-02a"
   ],
   "parameters": [],
   "extension": null
  },
  {
   "id": "B-02a",
   "level": "recommended",
   "applies_to": [
    "building"
   ],
   "guide": "1 Builder's and Architect's",
   "statement": "Prefer plain metres (a `METRE` unit with no prefix) over a prefixed or conversion-based unit, which some tools mishandle.",
   "rationale": "Plain metres avoid conversion mistakes.",
   "how_to_check": {
    "tool": "tools/check_ifc.py",
    "command": "python3 tools/check_ifc.py MASTER.ifc --profile PROFILE.json --finish-schedule finishes/finish-schedule.json --json",
    "method": "automated: the finding carries rule id B-02a"
   },
   "automated": true,
   "fix_hint": "Use an unprefixed METRE unit.",
   "examples": {
    "good": "IFCSIUNIT(*,.LENGTHUNIT.,$,.METRE.)",
    "bad": "IFCSIUNIT(*,.LENGTHUNIT.,.MILLI.,.METRE.)"
   },
   "related": [
    "B-02"
   ],
   "parameters": [],
   "extension": null
  },
  {
   "id": "B-03",
   "level": "recommended",
   "applies_to": [
    "building"
   ],
   "guide": "1 Builder's and Architect's",
   "statement": "Deliver one coordinated master file per placement area, and send per-building files only as alternates.",
   "rationale": "A consumer ingests one source file per placement area; others are ignored.",
   "how_to_check": {
    "tool": null,
    "command": null,
    "method": "review: no script checks this rule; compare the finished work with the statement"
   },
   "automated": false,
   "fix_hint": "Merge everything into one master IFC file; keep per-building files only under ifc/alternates/.",
   "examples": {
    "good": "ifc/site-master.ifc",
    "bad": "three building files all in ifc/"
   },
   "related": [
    "X-13"
   ],
   "parameters": [],
   "extension": null
  },
  {
   "id": "B-04",
   "level": "required",
   "applies_to": [
    "building"
   ],
   "guide": "1 Builder's and Architect's",
   "statement": "Keep the file plain ASCII: write every non-ASCII character with the format's escape (`\\X2\\00B7\\X0\\` for a middle dot, `\\X2\\2014\\X0\\` for a long dash).",
   "rationale": "Raw non-ASCII bytes are decoded differently by different tools, so names and text change.",
   "how_to_check": {
    "tool": "tools/check_ifc.py",
    "command": "python3 tools/check_ifc.py MASTER.ifc --profile PROFILE.json --finish-schedule finishes/finish-schedule.json --json",
    "method": "automated: the finding carries rule id B-04"
   },
   "automated": true,
   "fix_hint": "Re-export with one entity per line and encode non-ASCII characters with the format escapes (for example \\X2\\00B7\\X0\\).",
   "examples": {
    "good": "#12=IFCPROPERTYSINGLEVALUE('RoomId',$,IFCTEXT('A-101'),$);",
    "bad": "an entity broken over two lines, or a raw 0xB7 byte"
   },
   "related": [],
   "parameters": [],
   "extension": null
  },
  {
   "id": "B-05",
   "level": "required",
   "applies_to": [
    "building"
   ],
   "guide": "1 Builder's and Architect's",
   "statement": "Stay within the profile's hard limits: `limits.maxFileMegabytes`, `limits.maxVertices` and `limits.maxTriangles`.",
   "rationale": "Every reader has memory and time limits; a file over them is refused or truncated.",
   "how_to_check": {
    "tool": "tools/check_ifc.py",
    "command": "python3 tools/check_ifc.py MASTER.ifc --profile PROFILE.json --finish-schedule finishes/finish-schedule.json --json",
    "method": "automated: the finding carries rule id B-05"
   },
   "automated": true,
   "fix_hint": "Reduce geometry (simpler rails, fewer segments, drop hidden detail) or split the work into several placement areas until the file is within the profile's limits.",
   "examples": {
    "good": "1.2 MB file, 20,000 triangles",
    "bad": "130 MB file"
   },
   "related": [
    "B-09",
    "B-120"
   ],
   "parameters": [
    "limits.maxFileMegabytes",
    "limits.maxVertices",
    "limits.maxTriangles"
   ],
   "extension": null
  },
  {
   "id": "B-06",
   "level": "required",
   "applies_to": [
    "building"
   ],
   "guide": "1 Builder's and Architect's",
   "statement": "Use geometry that every common reader can display: swept solids (`IfcExtrudedAreaSolid` with rectangle, circle, arbitrary closed or arbitrary-with-voids profiles), faceted breps or polygonal face sets, and mapped items.",
   "rationale": "Many readers drop representations they cannot tessellate, silently, so the element vanishes.",
   "how_to_check": {
    "tool": "tools/check_ifc.py",
    "command": "python3 tools/check_ifc.py MASTER.ifc --profile PROFILE.json --finish-schedule finishes/finish-schedule.json --json",
    "method": "automated: the finding carries rule id B-06"
   },
   "automated": true,
   "fix_hint": "Rebuild the product from extruded profiles, faceted breps or mapped items; avoid swept disks and boolean-heavy breps.",
   "examples": {
    "good": "IfcExtrudedAreaSolid with a rectangle profile",
    "bad": "IfcSweptDiskSolid railing"
   },
   "related": [],
   "parameters": [],
   "extension": null
  },
  {
   "id": "B-07",
   "level": "recommended",
   "applies_to": [
    "building"
   ],
   "guide": "1 Builder's and Architect's",
   "statement": "Make the export deterministic: the same inputs give a byte-identical file (fixed timestamps, stable ordering, `GlobalId` values derived from stable keys).",
   "rationale": "Re-ingesting a revision must reproduce the same result or saved references break.",
   "how_to_check": {
    "tool": null,
    "command": null,
    "method": "review: no script checks this rule; compare the finished work with the statement"
   },
   "automated": false,
   "fix_hint": "Make the exporter deterministic: fixed header time, stable ordering, GlobalIds derived from stable keys.",
   "examples": {
    "good": "two exports are byte-identical",
    "bad": "GlobalIds regenerated randomly each export"
   },
   "related": [
    "B-70",
    "X-50"
   ],
   "parameters": [],
   "extension": null
  },
  {
   "id": "B-08",
   "level": "recommended",
   "applies_to": [
    "building"
   ],
   "guide": "1 Builder's and Architect's",
   "statement": "Write each STEP entity on a single line when the profile asks (`file.singleLineEntities`).",
   "rationale": "Line-oriented tools, diff tools and simple readers handle one-entity-per-line files; wrapped entities are valid but can be missed.",
   "how_to_check": {
    "tool": "tools/check_ifc.py",
    "command": "python3 tools/check_ifc.py MASTER.ifc --profile PROFILE.json --finish-schedule finishes/finish-schedule.json --json",
    "method": "automated: the finding carries rule id B-08"
   },
   "automated": true,
   "fix_hint": "Re-export with one entity per line, or reformat the file so each entity stays on a single line.",
   "examples": {
    "good": "#12=IFCWALL(...);",
    "bad": "an entity continued on the next line"
   },
   "related": [],
   "parameters": [
    "file.singleLineEntities"
   ],
   "extension": null
  },
  {
   "id": "B-09",
   "level": "recommended",
   "applies_to": [
    "building"
   ],
   "guide": "1 Builder's and Architect's",
   "statement": "Keep the file below the profile's recommended size, `budgets.recommendedFileMegabytes`.",
   "rationale": "Very large files load slowly and are hard to review.",
   "how_to_check": {
    "tool": "tools/check_ifc.py",
    "command": "python3 tools/check_ifc.py MASTER.ifc --profile PROFILE.json --finish-schedule finishes/finish-schedule.json --json",
    "method": "automated: the finding carries rule id B-09"
   },
   "automated": true,
   "fix_hint": "Reduce the file below the profile's budgets.recommendedFileMegabytes.",
   "examples": {
    "good": "",
    "bad": ""
   },
   "related": [
    "B-05"
   ],
   "parameters": [
    "budgets.recommendedFileMegabytes"
   ],
   "extension": null
  },
  {
   "id": "B-10",
   "level": "required",
   "applies_to": [
    "building"
   ],
   "guide": "1 Builder's and Architect's",
   "statement": "Use a right-handed frame with Z up and the horizontal axes the profile states (`frame.horizontalAxes`), in metres.",